{
  "registry_version": "1.0.0",
  "updated_at": "2026-09-29T12:40:00+08:00",
  "policy": {
    "selection": "need-driven",
    "update_check": "weekly-and-before-use",
    "automatic_upgrade": false
  },
  "capabilities": [
    {
      "id": "foundation-control-plane",
      "label": "Lab Research OS Foundation / checkpoint / handoff",
      "kind": "control-plane",
      "tier": "core",
      "availability": "live",
      "qualification": "qualified",
      "workloads": ["resume", "checkpoint", "handoff", "verification-state"],
      "trigger": "EVENT",
      "source": "tools/foundation.py",
      "current_version": "project-owned",
      "update_policy": "manual-review",
      "last_verified": "2026-09-29T12:07:41+08:00",
      "evidence": ["CHECKPOINT.md", "protocols/HANDOFF.md", "protocols/VERIFICATION.md"],
      "fallback": "Read the immutable checkpoint and stop writes if LATEST integrity or ownership conflicts."
    },
    {
      "id": "daily-paper-private-skill",
      "label": "Sediment-phosphorus Daily Paper private Skill",
      "kind": "skill",
      "tier": "core",
      "availability": "live",
      "qualification": "partial",
      "workloads": ["daily-literature-radar", "evidence-ready-notes", "human-pi-daily-brief"],
      "trigger": "TIME",
      "source": "C:/Users/ASUS/.codex/skills/sediment-phosphorus-daily-private",
      "current_version": null,
      "update_policy": "manual-review",
      "last_verified": "2026-09-29T11:27:30+08:00",
      "evidence": ["artifacts/daily-paper/CURRENT-STATE.md", "artifacts/daily-paper/VALIDATION.md"],
      "fallback": "Preserve the existing conversation, archive and last verified issue; do not fabricate a new note without lawful full text.",
      "notes": "Core workflow is live; the complete post-contract source-visual and portable-path issue remains pending live qualification."
    },
    {
      "id": "document-pdf-toolchain",
      "label": "Document and PDF production toolchain",
      "kind": "toolchain",
      "tier": "core",
      "availability": "live",
      "qualification": "partial",
      "workloads": ["docx-generation", "pdf-rendering", "visual-inspection", "path-validation"],
      "trigger": "EVENT",
      "source": "Codex bundled document/PDF runtime plus private Daily Paper validators",
      "current_version": "runtime-managed",
      "update_policy": "runtime-managed",
      "last_verified": "2026-09-29T11:27:30+08:00",
      "evidence": ["artifacts/daily-paper/PILOT-073-VERIFICATION.md", "artifacts/daily-paper/VALIDATION.md"],
      "fallback": "Retain source artifacts and publish only paths that open and render directly."
    },
    {
      "id": "codex-app-control-mcp",
      "label": "Codex App thread, automation and artifact control MCP",
      "kind": "mcp",
      "tier": "core",
      "availability": "live",
      "qualification": "partial",
      "workloads": ["thread-coordination", "automation-management", "artifact-management"],
      "trigger": "ON_DEMAND",
      "source": "mcp__codex_app",
      "current_version": "runtime-managed",
      "update_policy": "runtime-managed",
      "last_verified": "2026-09-29T12:10:00+08:00",
      "evidence": ["artifacts/daily-paper/VALIDATION.md"],
      "fallback": "Use canonical files and local Foundation tools; never infer an external write from missing MCP access."
    },
    {
      "id": "web-literature-research",
      "label": "Primary-source web and literature research",
      "kind": "toolchain",
      "tier": "core",
      "availability": "live",
      "qualification": "partial",
      "workloads": ["literature-discovery", "official-document-check", "release-monitoring"],
      "trigger": "ON_DEMAND",
      "source": "Codex web research runtime",
      "current_version": "runtime-managed",
      "update_policy": "runtime-managed",
      "last_verified": "2026-09-29T12:15:00+08:00",
      "evidence": ["artifacts/GPT6-DSH-PUBLIC-RELEASE-ASSESSMENT.md"],
      "fallback": "Use publisher, DOI, repository or official vendor pages; label unavailable full text and do not promote summaries as evidence."
    },
    {
      "id": "dsh-core",
      "label": "DeepSeek Harness core",
      "kind": "harness",
      "tier": "core",
      "availability": "live",
      "qualification": "qualified",
      "workloads": ["deepseek-text-work", "headless-bounded-execution", "web-ui"],
      "trigger": "ON_DEMAND",
      "source": "global npm package @deepseek-ai/dsh",
      "current_version": "0.1.7-rc.2",
      "update_policy": "manual-review",
      "last_verified": "2026-09-29T12:37:00+08:00",
      "evidence": ["artifacts/DSH-017-UPGRADE-REPORT.md"],
      "fallback": "Use the pre-upgrade backup and reinstall 0.1.1-rc.2 if the qualified clean profiles fail."
    },
    {
      "id": "dsh-lab-profiles",
      "label": "DSH lab-research Web and lab-headless profiles",
      "kind": "profile",
      "tier": "core",
      "availability": "live",
      "qualification": "qualified",
      "workloads": ["lab-web-ui", "bounded-headless-deepseek-call"],
      "trigger": "ON_DEMAND",
      "source": "C:/Users/ASUS/.dsh/profiles/lab-research and C:/Users/ASUS/.dsh/profiles/lab-headless",
      "current_version": "0.1.7-rc.2-compatible",
      "update_policy": "manual-review",
      "last_verified": "2026-09-29T12:37:00+08:00",
      "evidence": ["artifacts/DSH-017-UPGRADE-REPORT.md"],
      "fallback": "Use lab-headless for bounded text work if the Web UI or optional plugins fail."
    },
    {
      "id": "dsh-sol-luna-router",
      "label": "Legacy DSH Sol/Luna router",
      "kind": "router",
      "tier": "watch-only",
      "availability": "configured",
      "qualification": "blocked",
      "workloads": ["legacy-mixed-provider-routing"],
      "trigger": "EVENT",
      "source": "C:/Users/ASUS/.dsh/plugins/dsh-sol-luna-router",
      "current_version": "0.1.0",
      "update_policy": "pinned",
      "last_verified": "2026-09-29T12:22:00+08:00",
      "evidence": ["artifacts/DSH-017-UPGRADE-REPORT.md", "artifacts/INFRASTRUCTURE-MAP.md"],
      "fallback": "Use explicit Lab Research OS routing and clean DSH profiles; do not load the legacy router until its APIs and GPT-6 routes are migrated.",
      "notes": "Contains legacy GPT-5.6 and retired DeepSeek model identifiers and is intentionally excluded from the clean profiles."
    },
    {
      "id": "exa-mcp",
      "label": "Exa MCP literature/web connector",
      "kind": "mcp",
      "tier": "watch-only",
      "availability": "unknown",
      "qualification": "blocked",
      "workloads": ["optional-frontier-search"],
      "trigger": "ON_DEMAND",
      "source": "legacy DSH web profile mcp-exa entry",
      "current_version": null,
      "update_policy": "manual-review",
      "last_verified": null,
      "evidence": ["artifacts/INFRASTRUCTURE-MAP.md"],
      "fallback": "Use the current web research runtime and primary sources; do not depend on Exa availability."
    },
    {
      "id": "r-scientific-analysis",
      "label": "R data, statistics, visualization and reproducibility Skills",
      "kind": "skill",
      "tier": "on-demand",
      "availability": "installed",
      "qualification": "unverified",
      "workloads": ["data-qaqc", "statistics", "scientific-figures", "reproducible-analysis"],
      "trigger": "STATE",
      "source": "C:/Users/ASUS/.codex/skills/r-analytics",
      "current_version": null,
      "update_policy": "manual-review",
      "last_verified": null,
      "evidence": ["PROJECT.md"],
      "fallback": "Use explicit reviewed scripts and preserve environment/package versions; do not load the full skill tree before DATA_READY."
    },
    {
      "id": "spss-analysis",
      "label": "SPSS cleaning, test selection, syntax and reporting Skills",
      "kind": "skill",
      "tier": "on-demand",
      "availability": "installed",
      "qualification": "unverified",
      "workloads": ["spss-cleaning", "statistical-test-selection", "spss-reporting"],
      "trigger": "STATE",
      "source": "C:/Users/ASUS/.codex/skills/spss-*",
      "current_version": null,
      "update_policy": "manual-review",
      "last_verified": null,
      "evidence": ["PROJECT.md"],
      "fallback": "Use a declared analysis plan and independent statistical review; absence of SPSS integration must not block R or plain-script analysis."
    },
    {
      "id": "research-visual-generation",
      "label": "Figma/Image generation for explanatory research visuals",
      "kind": "skill",
      "tier": "on-demand",
      "availability": "installed",
      "qualification": "unverified",
      "workloads": ["conceptual-diagrams", "presentation-graphics"],
      "trigger": "EVENT",
      "source": "Codex Figma and image-generation capabilities",
      "current_version": "runtime-managed",
      "update_policy": "runtime-managed",
      "last_verified": null,
      "evidence": ["protocols/RESEARCH-AUTOMATION.md"],
      "fallback": "Use source-traceable local diagrams; generated imagery must never substitute for evidence-bearing source figures."
    },
    {
      "id": "google-drive-collaboration",
      "label": "Google Drive/Docs/Sheets/Slides connector",
      "kind": "mcp",
      "tier": "on-demand",
      "availability": "installed",
      "qualification": "unverified",
      "workloads": ["explicit-cloud-document-collaboration"],
      "trigger": "ON_DEMAND",
      "source": "Codex Google Drive plugin",
      "current_version": "runtime-managed",
      "update_policy": "runtime-managed",
      "last_verified": null,
      "evidence": ["PROJECT.md"],
      "fallback": "Keep canonical state in the repository; do not upload private research material without explicit Human PI scope."
    }
  ]
}
